************************************************************
*                                                          *
*                     W E L C O M E to                     *
*              M A D G R A P H 5 _ a M C @ N L O           *
*                                                          *
*                                                          *
*                 *                       *                *
*                   *        * *        *                  *
*                     * * * * 5 * * * *                    *
*                   *        * *        *                  *
*                 *                       *                *
*                                                          *
*         VERSION 3.5.1                 2023-07-11         *
*                                                          *
*    The MadGraph5_aMC@NLO Development Team - Find us at   *
*              http://madgraph.phys.ucl.ac.be/             *
*                            and                           *
*            http://amcatnlo.web.cern.ch/amcatnlo/         *
*                                                          *
*               Type 'help' for in-line help.              *
*           Type 'tutorial' to learn how MG5 works         *
*    Type 'tutorial aMCatNLO' to learn how aMC@NLO works   *
*    Type 'tutorial MadLoop' to learn how MadLoop works    *
*                                                          *
************************************************************
load MG5 configuration from ../../../../srv/localstage/condor/dir_3049443/mg5amcnlo/input/mg5_configuration.txt 
fastjet-config does not seem to correspond to a valid fastjet-config executable (v3+). We will use fjcore instead.
 Please set the 'fastjet'variable to the full (absolute) /PATH/TO/fastjet-config (including fastjet-config).
 MG5_aMC> set fastjet /PATH/TO/fastjet-config

eMELA-config does not seem to correspond to a valid eMELA-config executable.
 Please set the 'fastjet'variable to the full (absolute) /PATH/TO/eMELA-config (including eMELA-config).
 MG5_aMC> set eMELA /PATH/TO/eMELA-config

lhapdf-config does not seem to correspond to a valid lhapdf-config executable. 
Please set the 'lhapdf' variable to the (absolute) /PATH/TO/lhapdf-config (including lhapdf-config).
Note that you can still compile and run aMC@NLO with the built-in PDFs
 MG5_aMC> set lhapdf /PATH/TO/lhapdf-config

None does not seem to correspond to a valid lhapdf-config executable. 
Please set the 'lhapdf' variable to the (absolute) /PATH/TO/lhapdf-config (including lhapdf-config).
Note that you can still compile and run aMC@NLO with the built-in PDFs
 MG5_aMC> set lhapdf /PATH/TO/lhapdf-config

Using default text editor "vi". Set another one in ./input/mg5_configuration.txt
Using default eps viewer "evince". Set another one in ./input/mg5_configuration.txt
Using default web browser "firefox". Set another one in ./input/mg5_configuration.txt
import /vols/cms/us322/events_4b/02_event_generation_4b/mg_processes_2/background_172/madminer/cards/mg_commands_0.dat
The import format was not given, so we guess it as command
launch /vols/cms/us322/events_4b/02_event_generation_4b/mg_processes_2/background_172
************************************************************
*                                                          *
*                      W E L C O M E to                    *
*             M A D G R A P H 5 _ a M C @ N L O            *
*                      M A D E V E N T                     *
*                                                          *
*                 *                       *                *
*                   *        * *        *                  *
*                     * * * * 5 * * * *                    *
*                   *        * *        *                  *
*                 *                       *                *
*                                                          *
*         VERSION 3.5.1                 2023-07-11         *
*                                                          *
*    The MadGraph5_aMC@NLO Development Team - Find us at   *
*    https://server06.fynu.ucl.ac.be/projects/madgraph     *
*                                                          *
*               Type 'help' for in-line help.              *
*                                                          *
************************************************************
INFO: load configuration from /vols/cms/us322/events_4b/02_event_generation_4b/mg_processes_2/background_172/Cards/me5_configuration.txt  
INFO: load configuration from /srv/localstage/condor/dir_3049443/mg5amcnlo/input/mg5_configuration.txt  
INFO: load configuration from /vols/cms/us322/events_4b/02_event_generation_4b/mg_processes_2/background_172/Cards/me5_configuration.txt  
Using default text editor "vi". Set another one in ./input/mg5_configuration.txt
generate_events run_01
stty: 'standard input': Inappropriate ioctl for device
The following switches determine which programs are run:
/===========================================================================\
| 1. Choose the shower/hadronization program   [1m  shower[0m = [32mPythia8[0m           |
| 2. Choose the detector simulation program    [1mdetector[0m = [01mNot Avail.[0m        |
| 3. Choose an analysis package (plot/convert) [1manalysis[0m = [01mNot Avail.[0m        |
| 4. Decay onshell particles                   [1m madspin[0m = [31mOFF[0m               |
| 5. Add weights to events for new hypp.       [1mreweight[0m = [31mOFF[0m               |
\===========================================================================/
Either type the switch number (1 to 5) to change its setting,
Set any switch explicitly (e.g. type 'shower=OFF' at the prompt)
Type 'help' for the list of all valid option
Type '0', 'auto', 'done' or just press enter when you are done.
[1;34mfound line : order=LO[0m
[1;34mThis answer is not valid for current question. Keep it for next question and use here default: 0[0m
Do you want to edit a card (press enter to bypass editing)?
/------------------------------------------------------------\
|  [31m1[0m. param   : [32mparam_card.dat[0m                               |
|  [31m2[0m. run     : [32mrun_card.dat[0m                                 |
|  [31m3[0m. pythia8 : [32mpythia8_card.dat[0m                             |
\------------------------------------------------------------/
 you can also
   - enter the path to a valid card or banner.
   - use the 'set' command to modify a parameter directly.
     The set option works only for param_card and run_card.
     Type 'help set' for more information on this command.
   - call an external program (ASperGE/MadWidth/...).
     Type 'help' for the list of available command
 [[4m0[0m, done, 1, param, 2, run, 3, pythia8, enter path]
[1;34mfound line : order=LO[0m
[1;34mThis answer is not valid for current question. Keep it for next question and use here default: 0[0m
INFO: Update the dependent parameter of the param_card.dat 
[1;34mWARNING: update the strong coupling value (alpha_s) to the value from the pdf selected: 0.119 [0m
[1;34mWARNING: Unknow type of information in the card: dim64f2l,renor,dim6,dim62f,dim64f,loop,dim64f4l [0m
Generating 25000 events with run name run_01
survey  run_01 
INFO: compile directory 
[1;34mWARNING: information about "sminputs [1]" is missing using default value: 132.507. [0m
[1;34mWARNING: information about "yukawa [5]" is missing using default value: 4.7. [0m
[1;34mWARNING: information about "yukawa [15]" is missing using default value: 1.777. [0m
compile Source Directory
Error: no DISPLAY environment variable specified
Using random number seed offset = 4440
INFO: Running Survey 
Creating Jobs
Working on SubProcesses
INFO: Compiling for process 1/2. 
INFO:     P1_gg_bbxbbx  
  0%|          | 0/1233 [00:00<?, ?it/s] 48%|████▊     | 595/1233 [00:00<00:00, 5701.26it/s] 95%|█████████▁| 1166/1233 [00:00<00:00, 3144.97it/s]100%|██████████| 1233/1233 [00:00<00:00, 3565.30it/s]INFO: Compiling for process 2/2. 
INFO:     P1_qq_bbxbbx  

  0%|          | 0/853 [00:00<?, ?it/s]100%|██████████| 853/853 [00:00<00:00, 19279.95it/s]INFO:     P1_gg_bbxbbx  
INFO:     P1_qq_bbxbbx  
INFO:  Idle: 1,  Running: 6,  Completed: 0 [ current time: 19h47 ] 
INFO:  Idle: 0,  Running: 6,  Completed: 1 [  1m 34s  ] 
INFO:  Idle: 0,  Running: 5,  Completed: 2 [  1m 46s  ] 
INFO:  Idle: 0,  Running: 4,  Completed: 3 [  3m 5s  ] 
INFO:  Idle: 0,  Running: 3,  Completed: 4 [  3m 9s  ] 
INFO:  Idle: 0,  Running: 1,  Completed: 6 [  3m 12s  ] 
INFO:  Idle: 0,  Running: 0,  Completed: 7 [  3m 45s  ] 
INFO:  Idle: 0,  Running: 0,  Completed: 7 [  3m 45s  ] 
INFO: End survey 
refine 25000
Creating Jobs
INFO: Refine results to 25000 
INFO: Generating 25000.0 unweighted events. 
sum of cpu time of last step: 3m48s
INFO: Effective Luminosity 64845.507090149964 pb^-1 
INFO: need to improve 4 channels 
- Current estimate of cross-section: 0.46263806617 +- 0.009280623394823977
    P1_gg_bbxbbx 
    P1_qq_bbxbbx 
INFO:  Idle: 16,  Running: 16,  Completed: 0 [ current time: 19h50 ] 
INFO:  Idle: 15,  Running: 16,  Completed: 1 [  8m 2s  ] 
INFO:  Idle: 13,  Running: 16,  Completed: 3 [  8m 35s  ] 
INFO:  Idle: 12,  Running: 16,  Completed: 4 [  8m 44s  ] 
INFO:  Idle: 11,  Running: 16,  Completed: 5 [  16m 5s  ] 
INFO:  Idle: 10,  Running: 16,  Completed: 6 [  16m 34s  ] 
INFO:  Idle: 9,  Running: 16,  Completed: 7 [  17m 24s  ] 
INFO:  Idle: 8,  Running: 16,  Completed: 8 [  18m 13s  ] 
INFO:  Idle: 7,  Running: 16,  Completed: 9 [  18m 57s  ] 
INFO:  Idle: 6,  Running: 16,  Completed: 10 [  24m 27s  ] 
INFO:  Idle: 5,  Running: 16,  Completed: 11 [  24m 39s  ] 
INFO:  Idle: 4,  Running: 16,  Completed: 12 [  25m 12s  ] 
INFO:  Idle: 3,  Running: 16,  Completed: 13 [  25m 53s  ] 
INFO:  Idle: 1,  Running: 16,  Completed: 15 [  26m 16s  ] 
INFO:  Idle: 0,  Running: 16,  Completed: 16 [  26m 45s  ] 
INFO:  Idle: 0,  Running: 15,  Completed: 17 [  27m 11s  ] 
INFO:  Idle: 0,  Running: 14,  Completed: 18 [  31m 24s  ] 
INFO:  Idle: 0,  Running: 13,  Completed: 19 [  36m 33s  ] 
INFO:  Idle: 0,  Running: 10,  Completed: 22 [  40m 40s  ] 
INFO:  Idle: 0,  Running: 8,  Completed: 24 [  41m 48s  ] 
INFO:  Idle: 0,  Running: 5,  Completed: 27 [  44m 28s  ] 
INFO:  Idle: 0,  Running: 3,  Completed: 29 [  46m 0s  ] 
INFO:  Idle: 0,  Running: 0,  Completed: 32 [  49m 29s  ] 
INFO:  Idle: 0,  Running: 0,  Completed: 32 [  49m 29s  ] 
INFO: Combining runs 
sum of cpu time of last step: 50m43s
INFO: finish refine 
refine 25000 --treshold=0.9
No need for second refine due to stability of cross-section
INFO: Combining Events 
  === Results Summary for run: run_01 tag: tag_1 ===

     Cross-section :   0.4553 +- 0.0009183 pb
     Nb of events :  25000
 
store_events
INFO: Storing parton level results 
INFO: End Parton 
reweight -from_cards
decay_events -from_cards
INFO: [92mRunning Pythia8 [arXiv:1410.3012][0m 
Splitting .lhe event file for PY8 parallelization...
Submitting Pythia8 jobs...
Pythia8 shower jobs: 1 Idle, 15 Running, 0 Done [8 seconds]
Pythia8 shower jobs: 0 Idle, 15 Running, 1 Done [3m09s]
Pythia8 shower jobs: 0 Idle, 14 Running, 2 Done [3m22s]
Pythia8 shower jobs: 0 Idle, 13 Running, 3 Done [3m24s]
Pythia8 shower jobs: 0 Idle, 12 Running, 4 Done [3m24s]
Pythia8 shower jobs: 0 Idle, 11 Running, 5 Done [3m28s]
Pythia8 shower jobs: 0 Idle, 10 Running, 6 Done [3m28s]
Pythia8 shower jobs: 0 Idle, 9 Running, 7 Done [3m30s]
Pythia8 shower jobs: 0 Idle, 8 Running, 8 Done [3m31s]
Pythia8 shower jobs: 0 Idle, 7 Running, 9 Done [3m32s]
Pythia8 shower jobs: 0 Idle, 6 Running, 10 Done [3m33s]
Pythia8 shower jobs: 0 Idle, 5 Running, 11 Done [3m35s]
Pythia8 shower jobs: 0 Idle, 4 Running, 12 Done [3m35s]
Pythia8 shower jobs: 0 Idle, 3 Running, 13 Done [3m37s]
Pythia8 shower jobs: 0 Idle, 2 Running, 14 Done [3m37s]
Pythia8 shower jobs: 0 Idle, 1 Running, 15 Done [3m38s]
Pythia8 shower jobs: 0 Idle, 0 Running, 16 Done [3m39s]
Merging results from the split PY8 runs...
INFO: Pythia8 shower finished after 4m44s. 
  === Results Summary for run: run_01 tag: tag_1 ===

     Cross-section :   0.4553 +- 0.0009183 pb
     Nb of events :  25000
 
INFO: storing files of previous run 
INFO: Storing Pythia8 files of previous run 
INFO: Done 
quit
INFO:  
order=LO
[1;34mCommand "order=LO" not recognized, please try again[0m
shower=Pythia8
[1;34mCommand "shower=Pythia8" not recognized, please try again[0m
detector=OFF
[1;34mCommand "detector=OFF" not recognized, please try again[0m
analysis=OFF
[1;34mCommand "analysis=OFF" not recognized, please try again[0m
madspin=OFF
[1;34mCommand "madspin=OFF" not recognized, please try again[0m
reweight=OFF
[1;34mCommand "reweight=OFF" not recognized, please try again[0m
done
[1;34mCommand "done" not recognized, please try again[0m
quit

